text,sentiment_category
öncelikle ürünü almakla hayatımın hatasını yaptım diyerek başlayayım fayanstaki ekmek kırıntılarını almıyor kırıntıların üzerinde 6-7 defa gidip gelmek gerekiyor turboda çalıştırmama üstelik kesinlikle iyi çekmiyor ilk günlerde halılardan çıkan toza bakarak amma iyi temizliyor dedim kanmayın i̇lk genel temizlikte halıyı bu çırpayım dedim aman allah'ın halım tozlanmamıştı dip köşede biriken tüyleri görmeniz lazımdı i̇yi süpürmediği dip köşe tüy tutmuştu eski rowenta süpürgem kat kat iyi şarjı evi bitirmeye yetmiyor üstelik turboda çalıştırmam gerekiyor sürekli mutfaktaki yere saçılanları toplamıyor saçlar sarılıyor makasla keserek çıkarıyorum şarjlı gırgır başka birşey değil halılı evler kesinlikle uygun değil ofis eh kablolu süpürgenin yaptığı çeyreğini yapmıyor gırgır fazla pahalı dolayısıyla 7 bin liram çöp oldu yapıca makine bilmiyorum i̇ade olmaz elimde patladı,1.2044871794871796
philips xc8349 alırken çok dikkatli olun garantisi sadece motor aksamını kapsıyor plastik aksamı kapsamıyor philips markası sadece malını satana arkasında tüketici hakem heyetine şikayet edeceğim philips müşteri hizmetleri görüşmemde amazon süpürgeyi satarken plastik aksamın garantisi yok demesi lazım dedi sonuç müşteri mağduriyeti philips in nede amazon sitesinin umurumda değil burasıtürki̇ye başka ülkede yaptırmazlar,-0.3392857142857142
ürünün emiş borusu tasarımsal olarak hatalı olduğu çok çabuk kırılıyor boru kırılıyor üzerindeki düğmeler kırılıyor ürünün kırık parçası garantiye girmediği imkanlarımla japon yapıştırıcısıyla yapıştırmaya çalıştım eskisi olmuyor bence şarjlı süpürgeler içerisinde philips en son alınacak markadır,-1.2613636363636362
çok pratik kibar hızlı şarj ısınma derecesine gayet iyi ailecek 4 5 tane aldık aynı zamanda f211 modeli osb type modeli olan 4 5 tane aldık çok güzel çalışıyor,1.5781565656565655
6 yıl olmuş şarj adaptörü telefonu arada ısındırıyor sıklık çok çok az fiyatına göre düşünmeden alın,-0.25
kaliteli ürün hızlı şarj ediyor phone tl kullanıyorum sıkıntısız tereddütsüz alınabilecek marka,1.2
i̇şlevi tatmin edici performans görüntüsü şık alacak arkadaşlar tepe den tepe ye ara kablo almalı usb den tepe ye uygun değildir kablo ürün içine dahil değil ürünü sipariş ederken ara kabloyu unutmayın amazon.com.tr bin çok farklı ürünleri satması siteyi bol bol kullanalım,0.8541666666666666
hızlı şarj ediyorki şaşırdım doğrusu başka marka 67 o çıkışlı performansında,-0.05
tavsiye ederim,0.125
ürün çok kaliteli hiçbir sorun yok,0.03571428571428581
evdeki cihazları şarj etmek aldım biraz büyüklermiş kaliteli sağlam,1.4659090909090908
eşimin phone telefonlarını apple match'larımızı çok hızlı şekilde şarj etmekte düşünmeden alın,-0.05
mükemmel kalitede uzun ömürlü,1.0
birdaha evime spike'n marka çöp sokmam powerbank aldım aynı markadan bataryası şişti,0.0
satın aldım phone samsun marka telefonda i̇yad tablette denedim birinde hızlı şarj desteklemedi i̇ade ettim güvenilir ürün değil maalesef,0.19999999999999996
ürünü 3 aydır sadece evde yatağımın başındaki prizde geceleri cihazımı şarj etmek kullanıyordum bugün itibariyle başına herhangi olay gelmemesine şarj etmemeye başladı,-0.1590909090909091
garanti süresi bitti ürün bozuldu,0.0
45 de 18 şarj etti neresi hızlıydı ürünün,-0.0208333333333333
adaptörü aldığım günden beri adaptörden çok yüksek sesle cızırtı sesi geliyor,0.1944444444444444
amazon tarafından kutulanması muazzamdı kutu gönderen kişi tarafından düzensiz özensiz kutulanmıştı kutu patlaktı diyebilirim resmen boş kutu bulup içine tıkıştırılmış gibiydi i̇çinden sadece sarı başlığı çıktı ürün çok güzel arkadaşlar ürünü ilk kutulayan kuruluş özensiz amazon'a yakışmayan durum söz konusu,-0.5454545454545455
ürün bozuldu garanti süreci alakalı bilgi alabilir miyim,0.0
aldığım günden beri tekliyordu 3. ayın sonunda şarj etmemeye başladı 3-5 kuruş fazla verin orijinal alın arkadaşlar keşke aldığım ilk gün iade etseydim elimde kaldı,-0.0625
ürünü d olması nedeniyle phone yanında macbook urla kullanırım almıştım ürün macbook takılı olduğunda klavyenin üst kısmındaki metal kısma dokununca elinizle dokununca hissedebileceğiniz elektriklenme olmaya başladı kullanamıyorum şarj aletinden 100 il kar edeceğiz 20000 il ilk makineyi yakacağız spike'n güvendik aldık önermiyorum,0.0
harika tavsiye ederim,1.125
kalitesi şaşmıyor sorunsuz kullanım,0.0
uzun zamandır kullanıyorum arkadaşım aynısından kullanıyor i̇kimiz gayet memnunuz tavsiye ederim,0.125
fiyatına göre iyi,0.6111111111111112
kesinlikle tavsiye ederim gerçek hızlı şarj,0.1583333333333333
i̇ş yeri yedek aldım apple orijinal ürüne göre boyutu büyük hız kalite bakımından gerisinde değil,0.5625
telefon ilk aldığımdan günden beri kullanıyorum fiyatı uygun hızlı şarj ediyor malzeme kalitesi çok iyi,1.0611111111111111
mükemmel ürün,1.0
sorun yok apple iyi,-0.35317460317460303
güzel,0.4545454545454545
orjinal markaların neredeyse 3 te 1 fiyatında type-c mikis'li tam 27w veriyorum bilmiyorum 45 dakikada dolması gereken telefonu 1.15 de dolduruyor in koruyor prize takarken takasta alev cikarmasi hariç sorunsuz bu urun,0.1875
gayet kaliteli ürün boyutu beklediğimden tık büyük,1.0
i̇phonelar alıyorsanız 27 matt şarj özelliğinin tamamını kullanamayacaksınız sanırsam phone yazılımsal kısıtlamaya yapıyor,0.0
plastik kalitesi kullanımı gayet iyi adaptörlere göre biraz büyük ağır,0.3905228758169935
40 o üstü almak varken aldım bilmiyorum,-0.0142857142857142
ürünün kutusu yıpranmış yırtık şekilde geldi ürünün boyutu biraz büyük marka ürün kalitesi gayet güzel üründe bulunan küçük fed olmasa olurmuş,0.15454545454545449
merhaba ürünü satın alalı iki seneyi geçti şuan şarj etmesinde problem stabil şekilde şarj edemiyorum telefonu garantisi yıl yardımcı olabilir misiniz,-0.08333333333333331
ölçüm değerlerini test cihazı gözlemledim vadedilen 27w değerini rahatlıkla sunabiliyor hızlı şarj destekleyen cihazlar kutusunun güvenlik etiketi açık geldiği 1 yıldız kırdım üründe herhangi sorun yoktu kullanılmamıştı,0.10624999999999996
emin olmamakla beraber phone 15 pro mal cihazla beraber çok ısınıyor ürünün kalitesi tartışılmaz isınmadan sakınarak kullanıyorum,-0.21250000000000002
gayet başarılı,1.0
hızlı kargo,-0.05